Original,Corrected
"teit Derftändiger Subörer auf fich gieben, wenn er ni feinem gang gelafenen Uccompagnement eine blofe Feftigteit und edle Einfalt bliden läffet, und dadurd) Den glänzenden Bortrag Der Sauptitimme mat [töhret. Shm barf nicht bange fetn, Daß man thu ben dem Jubören deswegen bergißt, weil er nicht ale Zugenblicte mit larmet. Sein, einem beritändigen Subörer tann nidht leicht etwas entwicen; ni ben Empfindungen feiner Geele find Melodie und Sarmonie jederzeit untrenn= bar. Erfordert es die Gelegenheit und der Character eines Güdes, fo tann Der Begleiter alsdent feinem aufgehaltenen feuer allenfalls den 3ügel faieffen laffen, moen Dei Sauptitimme paufiet, oder fimple Noten (244] borträget. Es wird jedoch hierzu viele Gefaidtic)teit und Einfat in den wahren Inhalt eines Etüdes erfordert, und man tann ichon mit einem ecompagnemente zuftieden feyn, welches blos die Unforderungen, auch obne ausdrüdliche 2indeutung, etfüllet, welde mi 19ten Paragraph der Einleitung gefaehen find. Wir werden zu d","zeit der verständige Zuhörer auf sich geben, wenn er in seinem ganz gelassenen Accompagnement eine bloße Festigkeit und edle Einfalt blicken lässet, und dadurch den glänzenden Vortrag der Hauptstimme mehr höret. Ihm darf nicht bange sein, dass man ihn bei dem Zuhören deswegen vergisst, weil er nicht alle Augenblicke mit lärmet. Nein, einem verständigen Zuhörer kann nicht leicht etwas entgehen; in den Empfindungen seiner Seele sind Melodie und Harmonie jederzeit untrennbar. Erfordert es die Gelegenheit und der Charakter eines Stückes, so kann der Begleiter aus seinem aufgehaltenen Feuer allenfalls den Zügel fassen lassen, wenn die Hauptstimme pausiert, oder simple Noten vorträgt. Es wird jedoch hierzu viel Geschicklichkeit und Einsicht in den wahren Inhalt eines Stückes erfordert, und man kann schon mit einem Accompagnement zufrieden sein, welches bloß die Anforderungen, auch ohne ausdrückliche Andeutung, erfüllt, welche im 19ten Paragraph der Einleitung geschehen sind."
"em Ende ni diefem Capitel, und in der Folge fortfahren, unfere Unmertungen nebft der Reinigteit zugleid hauptfädlich mit auf bas Seine der Begleitung zu ridten. 4. §. Es ift zuweilen nöthig, und dem Begleiter nidt eben unanftändig, fd) vor Der 2lusführung eines Gtüces mit dem, der die Sauptftimme vorzutragen bat, zu befprechen, und dem lettern die Frenheit wegen der Einrichtung des 2lccom-
pagnements zu überlafen. Einige wolen den Begleiter fehr eingefahräntt wiffen, einige aber nicht. Man gebet alfo burd eine vorher genommene Librede den ficherften Teg, weil die Mehnungen berfchieden find, und dei Sauptftimme zu wälen bat. 5.§. D i r machen unter den Gegenftänden des Bortrages den Unfang bey der Gtärte und Gawäde, und finden, Daß der Flügel mit einer Saftatur unter allen Inftrumenten, worauf man den Generalbaß [pielet, Den Begleiter wegen des Sorte und Diano am meiften in Berlegenheit feget. Es bleibet im hier nichts übrig, als daß er durc) eine beritärtte und verminderte Sarmonie

 N","Am Ende dieses Kapitels, und in der Folge fortfahren, unsere Anmerkungen nebst der Reinigkeit zugleich hauptsächlich mit auf das Seine der Begleitung zu richten. 4. §. Es ist zuweilen nötig, und dem Begleiter nicht eben unanständig, sich vor der Ausführung eines Stückes mit dem, der die Hauptstimme vorzutragen hat, zu besprechen, und dem Letzteren die Freiheit wegen der Einrichtung des Accompagnements zu überlassen. Einige wollen den Begleiter sehr eingeschränkt wissen, einige aber nicht. Man gebet also durch eine vorher genommene Absprache den sichersten Weg, weil die Meinungen verschieden sind, und die Hauptstimme zu wählen hat. 5. §. Wir machen unter den Gegenständen des Vortrages den Anfang bei der Stärke und Schwäche, und finden, dass der Flügel mit einer Tastatur unter allen Instrumenten, worauf man den Generalbass spielt, den Begleiter wegen des Forte und Piano am meisten in Verlegenheit setzt. Es bleibt ihm hier nichts übrig, als dass er durch eine vergrößerte und verminderte Harmonie..."
"eun und gwangigites Capitel.
62
diefe Sinboltommenbeit des gnitruments zu berbefjer fudet. Man muß fido alsbenn in adt nehmen, damit teine nöthige Siffer ausgelafjen, und teine unrechte verdoppelt werde. Einige nehmen zur Serausbringung des Piano einen ganz Furzen 2Infchlag der Saften noch mit zur Sülfe: allein der Bortrag leidet bierbey erftaunlid), und felbft unter den abgeftoffenen Noten vertragen die wenigften diefen fo gat Furzen Drud. Durd) einen feltenern 2inichlag mit der red)ten Sband, bey burchgehenden Stoten, fann (245] man nod) eber die Statie der Begleitung ichmäden.
Die faöne Erindung unfers berübmten Serrn Sole=
Flügel überhaupt, und befonders diejenigen, toelde nur ein Manual baben, boltommener gemachet, und die Edwierigteit, wegen des Diano, bet den letstern glüclid gehoben. Es wärezu münchen, Daß ale Flüget ni Der selt zur Ehre des guten Gefamads fo eingerichtet würden.
6 . §. Diefer Erfindung ungeachtet behält das Clavierd und das Fortepiano wegen der mancherlet 2lit","Ein und zwanzigstes Kapitel.
62
diese Unvollkommenheit des Instruments zu verbessern suchet. Man muß sich alsdann in Acht nehmen, damit keine nötige Ziffer ausgelassen, und keine unrechte verdoppelt werde. Einige nehmen zur Herausbringung des Piano einen ganz kurzen Anschlag der Tasten noch mit zur Hilfe: allein der Vortrag leidet hierbei erstaunlich, und selbst unter den abgestoßenen Noten vertragen die wenigsten diesen so gar kurzen Druck. Durch einen selteneren Anschlag mit der rechten Hand, bei durchgehenden Noten, kann [245] man noch eher die Stärke der Begleitung mindern.

Die schöne Erfindung unseres berühmten Herrn Silbermann hat die Flügel überhaupt, und besonders diejenigen, welche nur ein Manual haben, vollkommener gemacht, und die Schwierigkeit, wegen des Piano, bei den letzteren glücklich gehoben. Es wäre zu wünschen, dass alle Flügel nie mehr zur Ehre des guten Geschmacks so eingerichtet würden.

6. §. Dieser Erfindung ungeachtet behält das Clavier und das Fortepiano wegen der mancherlei..."
", Dei Gtärde und Gawäde allmählig vorzutragen, vor den Flügeln und Drgeln vieles boraus. Das Pedal bey den lettern thut feine guten Dienfte, wenn die Toten in der Grundftimme nicht zu gefahminde find, und der B a g burd ein fechzehnfüßiges Regifter burc- dringender gemacht werden tann. Ebe man aber den Gefang der Grunditimme berftümmelt, weil die Roten nicht alle mit den Füffen beraus gebradt werden tönnen: of thut man beffer, menn man bas Pedal megläflet, und die Grund- noten blos mit der linten Sand fpielet.
D i a n o B e y i n e Bi g e u n e e r e n S i g e i t s t o S a f a t e r g e t e t a t find folgende: Das Fortigimo und das Forte wird auf dem ftärtern Manuale
genommen.
Bey jenem tönnen die confonirenden 2ccorde ganz, und bet Den Diffonitenden, nur die Confonanzen baraus in der linten Sand mit ge- griffen werden, wenn es die Zusfübrung der Grundnoten erlaubet. Diefe Berdoppelung muf alsdenn nicht ni der Siefe, fondern nabe an der tedten Sand gefäheben, damit die Sarmonie bebde",", Die Stärke und Schwäche allmählich vorzutragen, vor den Flügeln und Orgeln vieles voraus. Das Pedal bei den Letzteren tut seine guten Dienste, wenn die Töne in der Grundstimme nicht zu zusammengezogen sind, und der Bass durch ein sechzehnfüßiges Register durchdringender gemacht werden kann. Ehe man aber den Gesang der Grundstimme verstümmelt, weil die Noten nicht alle mit den Füßen herausgebracht werden können: oft tut man besser, wenn man das Pedal weglässt, und die Grundnoten bloß mit der linken Hand spielt.

Diejenigen besonderer Eigenschaften sind folgende: Das Fortissimo und das Forte werden auf dem stärkeren Manuale genommen. 

Bei jenem können die konsonierenden Akkorde ganz, und bei den Dissonierenden nur die Konsonanzen daraus in der linken Hand mitgegriffen werden, wenn es die Zuführung der Grundnoten erlaubt. Diese Verdoppelung muss alsdann nicht in der Tiefe, sondern nahe an der rechten Hand geschehen, damit die Harmonie beide"
"r Sände zufammen gränze, und tein 3wifdenraum entftebe, zu gefchweigen, [246] baf widrigenfalls durd die brummende Siefe eine etelhafte Sindeutlichteit verurfachet würde. Die bloffe Berdoppelung der Grundnoten mit der Detave in der linten Sand ift ebenfalls bon einer burdbringenden Wirtung, und alsdenn unentbehrlich, wenn diefe Goten nicht febr gefawind find, und leidt beraus gebracht werden tönnen, babet aber einen gewiffen Gefang enthalten, welcher eine ziemliche Weite ein- nimmt. Bey Fugen, wenn das Shema eintritt, bed Nadahmungen, welce fart borgetragen werden follen, thut diefe Berdoppelung der Grundnoten feht gut. Denn aber ben einem Shema, oder überhaupt ben einem Gebanten,

 Bour Borteage. 63
welder einen befonderen 2lusdruc exfordert, einige bunte Siguren bortommen, welche mit einer Soand in Detaben nicht wobl beraus gebracht werden tönnen: Ío berdoppelt man wenigftens bie Sauptnuten, und [pielet bie übrigen einfac (a). Sierdurch behält die rechte Sand ibre Sarmonie, toelde be","r Sände zusammen grenze, und kein Zwischenraum entstehe, zu geschweigen, [246] daß widrigenfalls durch die brummende Tiefe eine erhebliche Undeutlichkeit verursacht würde. Die bloße Verdoppelung der Grundnoten mit der Oktave in der linken Hand ist ebenfalls von einer durchdringenden Wirkung, und alsdann unentbehrlich, wenn diese Noten nicht sehr geschwind sind, und leicht herausgebracht werden können, dabei aber einen gewissen Gesang enthalten, welcher eine ziemliche Weite einnimmt. Bei Fugen, wenn das Thema eintritt, bei Nachahmungen, welche stark vorgetragen werden sollen, tut diese Verdoppelung der Grundnoten sehr gut. Denn aber bei einem Thema, oder überhaupt bei einem Gedanken,

bey Vorträgen. 63
welcher einen besonderen Ausdruck erfordert, einige bunte Figuren vorkommen, welche mit einer Hand in Oktaven nicht wohl herausgebracht werden können: So verdoppelt man wenigstens die Hauptnoten, und spielt die übrigen einfach (a). Hierdurch behält die rechte Hand ihre Harmonie, welche die"
"y contrapunctifden Gaden nicht wobl gemiffet werden tann. Get bem mezzo forte tann bie linte Sand mit den Baßnoten allein auf dem färtern Manuale bleiben, indem Die rechte auf dem fahmächern ihre Sarmonie borträget. B e t ) dem Piano fpielen bende Sände auf dem fchwächern Manuale. Das PianiBimo wird auf eben biefer Saftatur d u r die Derminderung der Sarmonie beraus gebrac)t. Man muß, um Diefen Dorfariften genug zu thun, bas Dbt beftändig mit zu Sülfe nehmen, weil die lindeutungen nicht allezeit genau bebgefetset find, und weil auch oft die Echwäche und Etärte des Bortrages bon Der Willüfr Des Lusführers der Sauptitimme abbänget.
All.
[247] 8. §. Ein Begleiter muß genau 2ditung geben, ob derjenige, den er begleitet, mit feiner Gtimme, oder mit feinem Initrumente Die Söbe und Liefe gleich ftatt babe, und ob die Söne der Sauptftimme ni ber ferne und in der ä b e gleid deutlich tlingen. Sit diejes lettere nicht. jo mub man die Begleitung, auch obne ausdrüdliche Undeutung, of einridten, da","y contrapunktischen Sätzen nicht wohl gemischt werden kann. Geht beim mezzo forte dann die linke Hand mit den Baßnoten allein auf dem stärkeren Manuale bleiben, indem die rechte auf dem schwächeren ihre Harmonie vorträgt. Beim Piano spielen beide Hände auf dem schwächeren Manuale. Das Pianissimo wird auf eben dieser Tastatur durch die Verminderung der Harmonie herausgebracht. Man muß, um diesen Vorschriften genug zu tun, das Ohr beständig mit zuhilfe nehmen, weil die Andeutungen nicht allezeit genau beigesetzt sind, und weil auch oft die Schwäche und Stärke des Vortrages von der Willkür des Ausführers der Hauptstimme abhängt.
All.
[247] 8. §. Ein Begleiter muß genau Achtung geben, ob derjenige, den er begleitet, mit seiner Stimme, oder mit seinem Instrumente die Höhe und Tiefe gleich statt habe, und ob die Töne der Hauptstimme in der Nähe und in der Ferne deutlich klingen. Ist dieses letztere nicht so, muß man die Begleitung, auch ohne ausdrückliche Andeutung, oft einrichten, dass"
"mit die fawaden Söne burd ein zu ftartes 2Iccompagnement nicht bededet werden. Stan Deig 3. E. bon der Querflöte, daß fie ni der Söde weit burcfticht, ni der Fiefe aber nicht, singeachtet fie übrigens bon gleidem Sone feyn tann.
9.§. Mian muß, wegen der Gtärte, das forte mi Zutti vom Forte mi Golo woHl unterfcheiden. Das lestere muß in einem genauen Zerbältnis mit der Gtärte der Sauptftimme ftehen; Das erftere bingegen tann foon ftärter fetn. 10. §. Wenn fich die Modulation ändert, of giebt man es burd eine Derftärtung ni der Begleitung zu entennen. Denn Der Bortrag alßdenn 3. €. fortigimo febn fol, of nimmtman bende Sände boler Sarmonie, bricht bie lestere von unten burtig berauf, und läffet benach in der linten Sand bloß die Grunonote mit threr Octave, in ber recoten Sand aber alle 3iffern liegen (a). Wenn gewiffe Bänge durd eine Derfetung wiederholet werden, jo berdoppelt man mit der linten Sand blos Dei Sauptgrundnoten zu meterer Deutlid)teit (b). Eind diefe Bänge of befchafen, Dag","mit den schwachen Tönen durch ein zu starkes Accompagnement nicht bedeckt werden. Stan Deig 3. E. von der Querflöte, daß sie in der Höhe weit durchsticht, in der Tiefe aber nicht, ungeachtet sie übrigens von gleichem Tone sein kann.
9.§. Man muß, wegen der Stärke, das forte mit tutti vom Forte mit solo wohl unterscheiden. Das letztere muß in einem genauen Verhältnis mit der Stärke der Hauptstimme stehen; das erstere hingegen kann schon stärker sein. 10. §. Wenn sich die Modulation ändert, so gibt man es durch eine Verstärkung in der Begleitung zu erkennen. Denn der Vortrag alsdann z. B. fortissimo sein soll, so nimmt man beide Hände voller Harmonie, bricht die letztere von unten durch, und lässet danach in der linken Hand bloß die Grundnote mit ihrer Octave, in der rechten Hand aber alle Stimmen liegen (a). Wenn gewisse Gänge durch eine Bewegung wiederholet werden, so verdoppelt man mit der linken Hand bloß die Hauptgrundnoten zu mehrerer Deutlichkeit (b). Sind diese Gänge oft beschaffen, dass..."
" fie ganz durd mit der Detabe mitgefpielet werden tönnen, fo unterfeeidet man folde Sauptnoten Durd eine verftatite Sarmonie, allenfalls mit bebden Sänden. Die Toten bet (c) mit einem Darüber
**

 64 Steun und wanzigites Capitel.
gefetten Etriche find es, bon denen hier die Rede ift. Zluffer der guten 2lus. nahme Diejes Sorte, betommen bey futzen Paufen die borfälagenden oten badurch ein befonderes Gewichte, und die Mitfpielenden eine groffe Erleidterung, weil betann-(248)termaaffen Dergleichen furge Daufen, aufer dem Elavier, biele Echwierigteiten machen (d). Diefe lettere Unmertung erftredet fich auf ale Gelegenheiten, wo furze Paufen bortommen.
(a)
(b)
(d)
ALZ. (b)
11. §.
Die erite glote nach einer Germate oder Generalpaufe {a)läget man gerne ftart an. Denn aud foon piano unter diefer Dote fteben folte, of giebet man ihr dennoch burch einen mäßig ftarten Unfchlag einen Nachdruct. Diefe Grenheit des Bortrages ift alsdenn befonders nüthig, wenn der vorher- gegangene Etillitand von dem","sie ganz durch mit der Debatte mitgespielet werden können, so unterscheidet man solche Hauptnoten Durch eine verstärkte Harmonie, allenfalls mit beiden Händen. Die Noten bei (c) mit einem Darüber
**

 64 Sechs und zwanzigstes Kapitel.
gesetzten Striche sind es, von denen hier die Rede ist. Außer der guten Ausnahme dieser Sorte, bekommen bei kurzen Pausen die vorsetzenden Noten dadurch ein besonderes Gewicht, und die Mitspielenden eine große Erleichterung, weil bekannt-(248)lich dergleichen kurze Pausen, außer dem Clavier, viele Schwierigkeiten machen (d). Diese letztere Anmerkung erstreckt sich auf alle Gelegenheiten, wo kurze Pausen vorkommen.
(a)
(b)
(d)
ALZ. (b)
11. §.
Die erste Note nach einer Fermate oder Generalpause {a)schlägt man gerne stark an. Denn auch wenn piano unter dieser Note stehen sollte, so gibt man ihr dennoch durch einen mäßig starken Anschlag einen Nachdruck. Diese Eigenheit des Vortrages ist alsdann besonders nötig, wenn der vorhergehende Zustand von dem"
" Gaffe allein querft gebrochen wird. Es ift beffer, baß man alsdenn eine rote etwas ftärter, als es eigentlich fern folte, an- ichläget, und baburc die Mitfpielenden ni der Ordnung erhält: als wenn man aus einer übertriebenen Genauigteit Diefes, denen übrigen Mitmufcirenden, wegen ber gehötigen Fachfolge, unentbehrliche Seichen weglaffen, und dadurc magen wolte, Daß ein anfehnlicher Zheil som Etüde, too der [249] Componift oft eine befondere Edönheit angebracht bat, burd eine Sinrichtigteit berdorben würde. In dergleiden Sällen ift der erfte Unfänger der Sühter, und wenn es auch die Bratfche trift.
12.§. Die groten, toelche ni eine Gohlußcadenz einleiten, werden ftart vorgetragen, wenn es auch nicht ausbrüdlid angedeutet ift. Man giebet ber Sauptftimme baburd) zu berfteben, bag man eine verzierte Eadenz ertuarte, und Daß man deswegen anbalten werde. Diefes Beiden ift befonders bet dem Zillegro nothmendig, weil die bergierten Gadenzen bey dem 2ibagio meht ein-
(c)

 Bom Bortrage. 65
gef","Gaffe allein quart gebrochen wird. Es ist besser, dass man alsdenn eine Note etwas stärker, als es eigentlich sein sollte, anschläget, und dadurch die Mitspielenden in der Ordnung erhält: als wenn man aus einer übertriebenen Genauigkeit dieses, den übrigen Mitmusizierenden, wegen der gehörigen Reihenfolge, unentbehrliche Zeichen weglassen, und dadurch meinen wollte, dass ein ansehnlicher Teil von der Etüde, wo der [249] Komponist oft eine besondere Schönheit angebracht hat, durch eine Unrichtigkeit verdorben würde. In dergleichen Fällen ist der erste Anführer der Schlüssel, und wenn es auch die Bratsche trifft.

12.§. Die Noten, welche in eine Schlusskadenz einleiten, werden stark vorgetragen, wenn es auch nicht ausdrücklich angedeutet ist. Man gibt der Hauptstimme dadurch zu verstehen, dass man eine verzierte Kadenz erwarte, und dass man deswegen anhalten werde. Dieses Zeichen ist besonders bei dem Allegro notwendig, weil die verzierte Kadenzen bei dem Adagio mehr ein-

(c)

Vom Vortrag. 65"
"ühret find, als ben jenem. Die Sauptftimme pfleget oft in diefem Falle Dei lesten Floten bor der Edlußcadenz burd ein (cleppendes Sorte borzutragen, Damit die Begleiter borher wifen, daß die Eadeng bergieret werden fol.
13. §. Denn Dei Sauptftimme eine lange 2lushaltung bat, welche n a c ben Regeln des guten Bortrages mit einem Pianifimo anfängt, bis auf ein Fortifimo almäblig anwächfet, und wieder nach und nad) bis auf ein Dianigimo abnimmt: of richtet fich der Begleiter hiernach auf bas genaueite.
Er wendet ale Rünfte, das Forte und Diano berauszubringen, of siel ihm möglich ift, an. Er wächft und fällt zugleich mit; nicht mebr, nicht weniger.
14.S. Der Belegenheit ber abgejtoffenen und gezogenen Noten merten wir an, baß man bey den 2lecorden, wozu die Grundnoten nicht aus- brüdlid abgeftoffen werden follen, nicht nöthig bat, ale Gtimmen auf das neue anzufc)lagen.
Die Intervallen, telde mi vorhergebenden Iccorde fa)on da find, und mi darauf folgenden liegen bleiben fönnen, läffet man","uehret sein, als den jenem. Die Hauptstimme pfleget oft in diesem Falle die letzten Noten vor der Schlußkadenz durch ein klappendes Forte vorzutragen, damit die Begleiter vorher wissen, dass die Sätze beherziget werden sollen.

§ 13. Wenn die Hauptstimme eine lange Aushaltung hat, welche nach den Regeln des guten Vortrages mit einem Pianissimo anfängt, bis auf ein Fortissimo allmählich anwächst, und wieder nach und nach bis auf ein Pianissimo abnimmt: so richtet sich der Begleiter hiernach auf das genaueste. Er wendet alle Künste an, das Forte und Piano herauszubringen, so viel ihm möglich ist. Er wächst und fällt zugleich mit; nicht mehr, nicht weniger.

§ 14. Der Belegenheit der abgestoßenen und gezogenen Noten merken wir an, dass man bei den Akkorden, wozu die Grundnoten nicht ausdrücklich abgestoßen werden sollen, nicht nötig hat, alle Stimmen aufs neue anzuschlagen. Die Intervalle, welche in vorhergehenden Akkorden schon da sind, und in darauf folgenden liegen bleiben können, lässt man"
" liegen. Durc Diefen Bortrag, wenn er zumal mit flieffenden Progreffionen i n ber beften Lage vergefelfchaftet ift, erhält bie Begleitung eine fingende Wirtung. Bey. gezogenen Toten ift er unentbehrlich). Qlus diefer guten sirface find die meiften Erempel diefes [250] Buches ni dergleiden Lusführung borgebilbet worden, damit die Lernenden bebgeiten an biefe 2lit von unterhaltendem Bortrage ge- mähnet, und bor dem of gewöhnlichen als etelbaften Gehade beb dem General.
bajje bewahret werden.
Denn die Seitmaaffe fo febt langfam, und das Suftrument morauf man fpielet, of ungemein [aleat ift, b a g die liegen gebliebenen Interballen nicht hinlänglicnachtlingen: of ift alßdenn ein wiederholter Unfalag nöthig. Luf den Drgeln brauchet man Diefe roth- bülfe nidht.
15. § . Der Bortrag der Gedgelntheile in ben unten folgenden Egempeln Minget im 2lbagio febr matt, wenn teine Puncte barzwifden freden. Man thut alfo moobl, wenn man bet der 2lusfabrung biefen Mangel erfeget. Sn der S d r e t b a r t ","liegen. Durch diesen Vortrag, wenn er zumal mit fließenden Progressionen in der besten Lage vergesellschaftet ist, erhält die Begleitung eine singende Wirkung. Bei gezogenen Tönen ist er unentbehrlich. Aus dieser guten Übung sind die meisten Exempel dieses [250] Buches in der gleichen Ausführung vorgebildet worden, damit die Lernenden an diese Art von unterhaltendem Vortrag gemahnt, und vor dem oft gewöhnlichen als edelhaftem Geschade des Generalbasses bewahrt werden.

Denn die Zeitmaße so sehr langsam, und das Instrument worauf man spielt, so ungemein schlecht ist, dass die liegen gebliebenen Intervalle nicht hinlänglich nachklingen: so ist alsdann ein wiederholter Anschlag nötig. Auf den Orgeln braucht man diese Notbehelfe nicht.

15. § Der Vortrag der Gedanken in den unten folgenden Exempeln klinget im Adagio sehr matt, wenn keine Punkte dazwischen treten. Man tut also wohl, wenn man bei der Ausführung diesen Mangel ersetzt. In der Tatbarkeit"
"der punctirten Stoten überhaupt feblet es noch febr oft an der gehörigen Genauigteit. Man bat daher wegen des Bortrags diefer 2 t t von Noten eine gewife Sauptregel feftfeten wollen, welche aber viele 2lusnahme leidet. Die nach dem Punct folgenden Toten follen nad Diefer Regel auf das fürzefte abgefertiget werden, und mehrentheils ift diefe Borchrift wabt: allein balo machet die Eintheilung gemier t o t e n in ber|ditedenen Gtimmen, vermöge welder fie in einem Zugenblide zujammen eintreten müfjen, eine Ulenberung; bals ift ein flattirender 2ffect, welcher das biefen punctitten Floten fonft eigene Srosige nicht verträget, die Sirface, daß man bey dem Puncte etwaß weniger anbält. Denn man alfo nur eine 2let vom Bortrage Diefer Poten zum Grundfage leget, fo verliebet man die übrigen Urten.
( B a d ), B e r f u c o , 1 1. ] 5

 66 Reun und awanzigites Capitel.
[251] 16. §. Sinter die nod) feblenden Eignaturen gebüten Hauptfächlid) Dei Puncte, moelche gwifchen den 3iffern mit eben dem Recht","der punktierten Noten überhaupt fehlt es noch sehr oft an der gehörigen Genauigkeit. Man hat daher wegen des Vortrags dieser Art von Noten eine gewisse Hauptregel festsetzen wollen, welche aber viele Ausnahmen leidet. Die nach dem Punkt folgenden Noten sollen nach dieser Regel auf das Kürzeste abgefertigt werden, und mehrenteils ist diese Vorschrift wahr: allein bald macht die Einteilung mehrerer Noten in verschiedenen Stimmen, vermöge welcher sie in einem Augenblick zusammen eintreten müssen, eine Änderung; bald ist ein flatternder Effekt, welcher das diesen punktierten Noten sonst eigene Großartige nicht verträgt, die Ursache, dass man bei dem Punkte etwas weniger anhält. Denn wenn man also nur eine Art vom Vortrag dieser Noten zum Grundsatz legt, so verließ man die übrigen Arten.
( Bad ), Versuch, 11. ] 5

66. Neues und zwanzigstes Kapitel.
[251] 16. §. Unter die noch fehlenden Signaturen gehören hauptsächlich die Punkte, welche zwischen den Ziffern mit eben dem Recht..."
